{
  "$schema": "https://json-schema.org/draft/2020-12/schema",
  "$id": "https://frontend-foundation.local/schemas/foundation.project.schema.json",
  "title": "Frontend Foundation Project Blueprint v1",
  "type": "object",
  "additionalProperties": false,
  "required": [
    "schemaVersion",
    "project",
    "foundation",
    "pages"
  ],
  "properties": {
    "schemaVersion": {
      "const": 1
    },
    "project": {
      "type": "object",
      "additionalProperties": false,
      "required": [
        "id",
        "title"
      ],
      "properties": {
        "id": {
          "type": "string",
          "pattern": "^[a-z][a-z0-9.-]*$"
        },
        "packageName": {
          "type": "string",
          "pattern": "^(?:@[a-z0-9][a-z0-9._-]*/)?[a-z0-9][a-z0-9._-]*$"
        },
        "title": {
          "type": "string",
          "minLength": 1
        }
      }
    },
    "foundation": {
      "type": "object",
      "additionalProperties": false,
      "properties": {
        "version": {
          "type": "string",
          "pattern": "^\\d+\\.\\d+\\.\\d+(?:-[0-9A-Za-z.-]+)?$"
        },
        "profile": {
          "enum": [
            "minimal",
            "management",
            "data-workbench"
          ]
        },
        "shell": {
          "enum": [
            "sidebar",
            "top-nav",
            "workspace",
            "bare"
          ]
        },
        "router": {
          "enum": [
            "browser",
            "hash"
          ]
        },
        "deployment": {
          "enum": [
            "none",
            "nginx"
          ]
        },
        "contract": {
          "enum": [
            "none",
            "openapi"
          ]
        }
      }
    },
    "theme": {
      "type": "object",
      "additionalProperties": false,
      "properties": {
        "primaryColor": {
          "type": "string",
          "minLength": 1
        },
        "borderRadius": {
          "type": "number",
          "minimum": 0
        },
        "fontFamily": {
          "type": "string",
          "minLength": 1
        },
        "token": {
          "type": "object"
        },
        "components": {
          "type": "object"
        },
        "layout": {
          "type": "object",
          "additionalProperties": false,
          "properties": {
            "sidebarWidth": {
              "type": "number",
              "minimum": 0
            },
            "headerHeight": {
              "type": "number",
              "minimum": 0
            },
            "contentPadding": {
              "type": "number",
              "minimum": 0
            },
            "contentMaxWidth": {
              "type": "number",
              "minimum": 0
            }
          }
        }
      }
    },
    "navigation": {
      "type": "object",
      "additionalProperties": false,
      "required": [
        "items"
      ],
      "properties": {
        "items": {
          "type": "array",
          "items": {
            "type": "object",
            "additionalProperties": false,
            "required": [
              "target",
              "label"
            ],
            "properties": {
              "target": {
                "type": "string",
                "pattern": "^[a-z][a-z0-9-]*$"
              },
              "label": {
                "type": "string",
                "minLength": 1
              },
              "order": {
                "type": "integer",
                "minimum": 0,
                "maximum": 100000
              }
            }
          }
        }
      }
    },
    "pages": {
      "type": "array",
      "minItems": 1,
      "contains": {
        "type": "object",
        "required": [
          "index"
        ],
        "properties": {
          "index": {
            "const": true
          }
        }
      },
      "minContains": 1,
      "maxContains": 1,
      "items": {
        "type": "object",
        "additionalProperties": false,
        "required": [
          "id",
          "title"
        ],
        "properties": {
          "id": {
            "type": "string",
            "pattern": "^[a-z][a-z0-9-]*$"
          },
          "title": {
            "type": "string",
            "minLength": 1
          },
          "pattern": {
            "enum": [
              "page",
              "management",
              "data-workbench",
              "dashboard",
              "master-detail",
              "split-pane",
              "workspace"
            ]
          },
          "index": {
            "type": "boolean"
          },
          "route": {
            "type": "string",
            "pattern": "^[a-z0-9][a-z0-9/_-]*$"
          },
          "permission": {
            "type": "string",
            "minLength": 1
          },
          "contracts": {
            "type": "array",
            "uniqueItems": true,
            "items": {
              "type": "string",
              "minLength": 1
            }
          },
          "composition": {
            "$ref": "#/$defs/visualNode"
          },
          "state": {
            "type": "array",
            "maxItems": 100,
            "items": {
              "$ref": "#/$defs/pageStateEntry"
            }
          },
          "actions": {
            "type": "array",
            "maxItems": 100,
            "items": {
              "$ref": "#/$defs/pageAction"
            }
          },
          "dataSources": {
            "type": "array",
            "maxItems": 50,
            "items": {
              "$ref": "#/$defs/pageDataSource"
            }
          },
          "operations": {
            "type": "array",
            "maxItems": 100,
            "items": {
              "$ref": "#/$defs/pageOperation"
            }
          }
        },
        "allOf": [
          {
            "if": {
              "properties": {
                "index": {
                  "const": true
                }
              },
              "required": [
                "index"
              ]
            },
            "then": {
              "not": {
                "required": [
                  "route"
                ]
              }
            },
            "else": {
              "required": [
                "route"
              ]
            }
          }
        ]
      }
    },
    "resources": {
      "type": "array",
      "items": {
        "type": "object",
        "additionalProperties": false,
        "required": [
          "source"
        ],
        "properties": {
          "source": {
            "type": "string",
            "minLength": 1
          }
        }
      }
    }
  },
  "$defs": {
    "visualNode": {
      "type": "object",
      "additionalProperties": false,
      "required": [
        "id",
        "kind",
        "type"
      ],
      "properties": {
        "id": {
          "type": "string",
          "pattern": "^[A-Za-z][A-Za-z0-9_-]*$"
        },
        "kind": {
          "enum": [
            "layout",
            "widget"
          ]
        },
        "type": {
          "type": "string",
          "minLength": 1
        },
        "label": {
          "type": "string",
          "minLength": 1
        },
        "props": {
          "type": "object"
        },
        "placement": {
          "type": "object",
          "additionalProperties": false,
          "properties": {
            "span": {
              "type": "integer",
              "minimum": 1,
              "maximum": 24
            }
          }
        },
        "children": {
          "type": "array",
          "items": {
            "$ref": "#/$defs/visualNode"
          }
        },
        "bindings": {
          "type": "object",
          "additionalProperties": {
            "$ref": "#/$defs/bindingReference"
          }
        },
        "events": {
          "type": "object",
          "additionalProperties": {
            "type": "array",
            "minItems": 1,
            "uniqueItems": true,
            "items": {
              "type": "string",
              "pattern": "^[A-Za-z][A-Za-z0-9_-]*$"
            }
          }
        }
      },
      "allOf": [
        {
          "if": {
            "properties": {
              "kind": {
                "const": "layout"
              }
            },
            "required": [
              "kind"
            ]
          },
          "then": {
            "properties": {
              "type": {
                "enum": [
                  "stack",
                  "grid",
                  "split",
                  "tabs"
                ]
              }
            }
          }
        },
        {
          "if": {
            "properties": {
              "kind": {
                "const": "widget"
              }
            },
            "required": [
              "kind"
            ]
          },
          "then": {
            "properties": {
              "type": {
                "oneOf": [
                  {
                    "enum": [
                      "panel",
                      "text",
                      "button",
                      "input",
                      "select",
                      "metric",
                      "placeholder"
                    ]
                  },
                  {
                    "type": "string",
                    "pattern": "^[a-z][a-z0-9-]*(?:\\.[a-z][a-z0-9-]*)+$"
                  }
                ]
              }
            }
          }
        }
      ]
    },
    "bindingReference": {
      "type": "object",
      "additionalProperties": false,
      "required": [
        "state"
      ],
      "properties": {
        "state": {
          "type": "string",
          "pattern": "^[a-z][A-Za-z0-9]*$"
        }
      }
    },
    "pageStateEntry": {
      "type": "object",
      "additionalProperties": false,
      "required": [
        "id",
        "type",
        "initial"
      ],
      "properties": {
        "id": {
          "type": "string",
          "pattern": "^[a-z][A-Za-z0-9]*$"
        },
        "type": {
          "enum": [
            "string",
            "number",
            "boolean"
          ]
        },
        "initial": {
          "oneOf": [
            {
              "type": "string"
            },
            {
              "type": "number"
            },
            {
              "type": "boolean"
            }
          ]
        }
      }
    },
    "actionValue": {
      "oneOf": [
        {
          "type": "string"
        },
        {
          "type": "number"
        },
        {
          "type": "boolean"
        },
        {
          "type": "object",
          "additionalProperties": false,
          "required": [
            "state"
          ],
          "properties": {
            "state": {
              "type": "string",
              "pattern": "^[a-z][A-Za-z0-9]*$"
            }
          }
        },
        {
          "type": "object",
          "additionalProperties": false,
          "required": [
            "event"
          ],
          "properties": {
            "event": {
              "const": "value"
            }
          }
        }
      ]
    },
    "actionStep": {
      "oneOf": [
        {
          "type": "object",
          "additionalProperties": false,
          "required": [
            "type",
            "state",
            "value"
          ],
          "properties": {
            "type": {
              "const": "set"
            },
            "state": {
              "type": "string",
              "pattern": "^[a-z][A-Za-z0-9]*$"
            },
            "value": {
              "$ref": "#/$defs/actionValue"
            }
          }
        },
        {
          "type": "object",
          "additionalProperties": false,
          "required": [
            "type",
            "state"
          ],
          "properties": {
            "type": {
              "const": "toggle"
            },
            "state": {
              "type": "string",
              "pattern": "^[a-z][A-Za-z0-9]*$"
            }
          }
        },
        {
          "type": "object",
          "additionalProperties": false,
          "required": [
            "type",
            "state"
          ],
          "properties": {
            "type": {
              "const": "increment"
            },
            "state": {
              "type": "string",
              "pattern": "^[a-z][A-Za-z0-9]*$"
            },
            "by": {
              "type": "number"
            }
          }
        },
        {
          "type": "object",
          "additionalProperties": false,
          "required": [
            "type",
            "state"
          ],
          "properties": {
            "type": {
              "const": "reset"
            },
            "state": {
              "type": "string",
              "pattern": "^[a-z][A-Za-z0-9]*$"
            }
          }
        },
        {
          "type": "object",
          "additionalProperties": false,
          "required": [
            "type",
            "operation"
          ],
          "properties": {
            "type": {
              "const": "invoke"
            },
            "operation": {
              "type": "string",
              "pattern": "^[A-Za-z][A-Za-z0-9_-]*$"
            }
          }
        },
        {
          "type": "object",
          "additionalProperties": false,
          "required": [
            "type",
            "to"
          ],
          "properties": {
            "type": {
              "const": "navigate"
            },
            "to": {
              "type": "string",
              "minLength": 1
            },
            "replace": {
              "type": "boolean"
            }
          }
        }
      ]
    },
    "pageAction": {
      "type": "object",
      "additionalProperties": false,
      "required": [
        "id",
        "steps"
      ],
      "properties": {
        "id": {
          "type": "string",
          "pattern": "^[A-Za-z][A-Za-z0-9_-]*$"
        },
        "steps": {
          "type": "array",
          "minItems": 1,
          "maxItems": 50,
          "items": {
            "$ref": "#/$defs/actionStep"
          }
        }
      }
    },
    "operationValue": {
      "oneOf": [
        {
          "type": [
            "string",
            "number",
            "boolean",
            "null"
          ]
        },
        {
          "type": "array",
          "items": {
            "$ref": "#/$defs/operationValue"
          }
        },
        {
          "type": "object",
          "additionalProperties": false,
          "required": [
            "$state"
          ],
          "properties": {
            "$state": {
              "type": "string",
              "pattern": "^[a-z][A-Za-z0-9]*$"
            }
          }
        },
        {
          "type": "object",
          "not": {
            "required": [
              "$state"
            ]
          },
          "additionalProperties": {
            "$ref": "#/$defs/operationValue"
          }
        }
      ]
    },
    "pageDataSource": {
      "type": "object",
      "additionalProperties": false,
      "required": [
        "id",
        "path"
      ],
      "properties": {
        "id": {
          "type": "string",
          "pattern": "^[A-Za-z][A-Za-z0-9_-]*$"
        },
        "type": {
          "const": "http"
        },
        "method": {
          "enum": [
            "GET",
            "POST",
            "PUT",
            "PATCH",
            "DELETE",
            "get",
            "post",
            "put",
            "patch",
            "delete"
          ]
        },
        "path": {
          "type": "string",
          "minLength": 1
        },
        "response": {
          "enum": [
            "json",
            "text",
            "none"
          ]
        }
      }
    },
    "pageOperationLifecycle": {
      "type": "object",
      "additionalProperties": false,
      "properties": {
        "pendingState": {
          "type": "string",
          "pattern": "^[a-z][A-Za-z0-9]*$"
        },
        "errorState": {
          "type": "string",
          "pattern": "^[a-z][A-Za-z0-9]*$"
        }
      }
    },
    "pageOperationResult": {
      "type": "object",
      "additionalProperties": false,
      "required": [
        "state"
      ],
      "properties": {
        "state": {
          "type": "string",
          "pattern": "^[a-z][A-Za-z0-9]*$"
        },
        "path": {
          "type": "string",
          "minLength": 1
        }
      }
    },
    "pageOperation": {
      "type": "object",
      "additionalProperties": false,
      "required": [
        "id",
        "source"
      ],
      "properties": {
        "id": {
          "type": "string",
          "pattern": "^[A-Za-z][A-Za-z0-9_-]*$"
        },
        "source": {
          "type": "string",
          "pattern": "^[A-Za-z][A-Za-z0-9_-]*$"
        },
        "query": {
          "type": "object",
          "additionalProperties": {
            "$ref": "#/$defs/queryValue"
          }
        },
        "body": {
          "$ref": "#/$defs/operationValue"
        },
        "lifecycle": {
          "$ref": "#/$defs/pageOperationLifecycle"
        },
        "result": {
          "type": "array",
          "maxItems": 50,
          "items": {
            "$ref": "#/$defs/pageOperationResult"
          }
        }
      }
    },
    "queryValue": {
      "oneOf": [
        {
          "type": [
            "string",
            "number",
            "boolean"
          ]
        },
        {
          "type": "object",
          "additionalProperties": false,
          "required": [
            "$state"
          ],
          "properties": {
            "$state": {
              "type": "string",
              "pattern": "^[a-z][A-Za-z0-9]*$"
            }
          }
        }
      ]
    }
  }
}
