{
  "schemaVersion": 1,
  "project": {
    "id": "ff.data-workbench.compare",
    "packageName": "ff-data-workbench-compare",
    "title": "FF需求驱动实验·Studio对照版"
  },
  "foundation": {
    "version": "0.21.0",
    "profile": "management",
    "shell": "workspace",
    "router": "browser",
    "deployment": "none",
    "contract": "none"
  },
  "theme": {
    "primaryColor": "#11765c",
    "layout": {
      "contentPadding": 20
    }
  },
  "navigation": {
    "items": [
      {
        "target": "import",
        "label": "文件入库",
        "order": 0
      },
      {
        "target": "datasets",
        "label": "数据集清单",
        "order": 10
      },
      {
        "target": "records",
        "label": "样例遥测查询",
        "order": 20
      }
    ]
  },
  "pages": [
    {
      "id": "import",
      "title": "文件入库",
      "pattern": "page",
      "index": true,
      "composition": {
        "id": "importRoot",
        "kind": "layout",
        "type": "stack",
        "props": {
          "gap": 18
        },
        "children": [
          {
            "id": "importHeading",
            "kind": "widget",
            "type": "text",
            "props": {
              "text": "文件导入 · 生成 SQLite",
              "variant": "title"
            }
          },
          {
            "id": "importNotice",
            "kind": "widget",
            "type": "text",
            "props": {
              "text": "对照实验：UTF-8 CSV/TSV/TXT，每次导入独立 SQLite，最多 20 MB。此页面只展示 FF 原生文件上传及业务适配能力。",
              "variant": "body"
            }
          },
          {
            "id": "fileUpload",
            "kind": "widget",
            "type": "placeholder",
            "props": {
              "title": "选择本地数据文件",
              "description": "Studio 体验模式提供实时功能"
            }
          },
          {
            "id": "importFoot",
            "kind": "widget",
            "type": "text",
            "props": {
              "text": "上传成功后，请切换“数据集清单”页。FF 原生上传组件尚不能选择 GB18030 编码、显示原字段映射/数值类型，且不会自动选中新数据库。",
              "variant": "body"
            }
          }
        ]
      }
    },
    {
      "id": "datasets",
      "title": "数据集清单",
      "pattern": "page",
      "route": "datasets",
      "composition": {
        "id": "datasetsRoot",
        "kind": "layout",
        "type": "stack",
        "props": {
          "gap": 18
        },
        "children": [
          {
            "id": "datasetsHeading",
            "kind": "widget",
            "type": "text",
            "props": {
              "text": "数据集清单 · SQLite 文件记录",
              "variant": "title"
            }
          },
          {
            "id": "datasetsNotice",
            "kind": "widget",
            "type": "text",
            "props": {
              "text": "以下为真实后端存储的数据库目录。支持搜索、分页和排序，但目前无法点选数据集并驱动另一个表格，也没有原生 SQLite 文件下载动作。",
              "variant": "body"
            }
          },
          {
            "id": "datasetsTable",
            "kind": "widget",
            "type": "placeholder",
            "props": {
              "title": "已导入数据库",
              "description": "Studio 体验模式提供实时功能"
            }
          }
        ]
      }
    },
    {
      "id": "records",
      "title": "样例遥测查询",
      "pattern": "page",
      "route": "records",
      "composition": {
        "id": "recordsRoot",
        "kind": "layout",
        "type": "stack",
        "props": {
          "gap": 18
        },
        "children": [
          {
            "id": "recordsHeading",
            "kind": "widget",
            "type": "text",
            "props": {
              "text": "样例遥测查询 · 固定六列",
              "variant": "title"
            }
          },
          {
            "id": "recordsNotice",
            "kind": "widget",
            "type": "text",
            "props": {
              "text": "仅接入最新一份且字段与随包示例一致的数据。表格搜索只匹配设备编号；单选筛选为状态；支持温度排序。不等价于原业务的任意列多条件 AND 和数值区间检索。",
              "variant": "body"
            }
          },
          {
            "id": "recordsTable",
            "kind": "widget",
            "type": "placeholder",
            "props": {
              "title": "最新示例遥测记录",
              "description": "Studio 体验模式提供实时功能"
            }
          },
          {
            "id": "recordsFoot",
            "kind": "widget",
            "type": "text",
            "props": {
              "text": "本页面没有“按当前所有条件导出 CSV”和“下载数据库”能力，这两项由 v0.1 独立业务页面提供，不得标为 FF 原生通过。",
              "variant": "body"
            }
          }
        ]
      }
    }
  ],
  "resources": []
}
